{
  "schema_version": "0.1.0",
  "evidence_id": "evidence-generated-workpaper-001",
  "evidence_type": "workpaper",
  "source": {
    "location_type": "generated_output",
    "locator": "output/handoff_package/gifi_summary.csv",
    "display_name": "Synthetic GIFI summary workpaper",
    "content_hash": "sha256:synthetic-gifi-summary-placeholder"
  },
  "sensitivity": "confidential",
  "record_path": "row:summary",
  "created_at": "2026-06-12T12:00:00Z",
  "retention_label": "tax-workpaper-synthetic",
  "notes": "Synthetic fixture derived from sample ledger data only."
}
